<?xml version="1.0" encoding="UTF-8"?>
<libro_de_cocina xmlns:xsi="http://www.w3.org/2001/XMLSchema-instance"
                 xsi:noNamespaceSchemaLocation="ejerreceta.xsd">
    <receta numero="1">
        <ingredientes>
            <ingrediente>Arroz</ingrediente>
            <ingrediente>Tomillo</ingrediente>
            <ingrediente>Pimienta</ingrediente>
        </ingredientes>
        <pasos>
            <medida> 5 gramos de tomillo</medida>
            <tamano>Grande</tamano>
        </pasos>
    </receta>
    <receta numero="2">
        <ingredientes>
            <ingrediente>Arroz</ingrediente>
            <ingrediente>Tomillo</ingrediente>
            <ingrediente>Pimienta</ingrediente>
        </ingredientes>
        <pasos>
            <paso numero="1"> Calentar agua hasta hervir</paso>
            <paso numero="2"> Echar tomillo y arroz</paso>
        </pasos>
    </receta>
</libro_de_cocina>